{
  "schema_version": "1.0",
  "epics": [
    {
      "id": "4de7a176-cb95-419c-a7d3-1522ff08d85d",
      "title": "资料与公告查询服务",
      "evidence_refs": [
        "0568d7fc-7a5c-4451-be14-d1a351a05e80",
        "e3d3cc2b-a867-445d-9b6c-958534e10fa0",
        "5fb4ca8c-205b-4045-ab44-94b0b76d92e8",
        "a1d48717-5a97-43e9-aa2e-da703b0127cb"
      ]
    },
    {
      "id": "082919ac-553b-4d1f-b0a7-b33a3661f2f3",
      "title": "既有资料接续与发布准备",
      "evidence_refs": [
        "1d8c0ae0-0d9e-4a3c-832e-07b66f86a2f8",
        "d94cc735-fd04-4c2c-878e-fa1aa15ab765",
        "35a43142-90c2-4a57-8ab4-c3d510ffccd7",
        "44106ccd-3f9a-40d0-a730-0f30c528c66f"
      ]
    }
  ],
  "features": [
    {
      "id": "63945bb7-424a-4289-86c2-4be15907723f",
      "epic_id": "4de7a176-cb95-419c-a7d3-1522ff08d85d",
      "title": "资料与公告列表查询",
      "evidence_refs": [
        "0568d7fc-7a5c-4451-be14-d1a351a05e80",
        "e3d3cc2b-a867-445d-9b6c-958534e10fa0",
        "a1d48717-5a97-43e9-aa2e-da703b0127cb"
      ]
    },
    {
      "id": "8157478e-cebe-4f4e-b782-21552e2f5d0c",
      "epic_id": "4de7a176-cb95-419c-a7d3-1522ff08d85d",
      "title": "公共查询交互一致性",
      "evidence_refs": [
        "5fb4ca8c-205b-4045-ab44-94b0b76d92e8",
        "d7c2d88e-c320-475c-b47b-4b89f341267e",
        "204788ee-2632-4112-a6c0-8f2bcad11976"
      ]
    },
    {
      "id": "15d9e368-7bbe-4c4c-9410-9785c6bc0d3c",
      "epic_id": "082919ac-553b-4d1f-b0a7-b33a3661f2f3",
      "title": "资料迁移资产与版本切换方案",
      "evidence_refs": [
        "1d8c0ae0-0d9e-4a3c-832e-07b66f86a2f8",
        "d94cc735-fd04-4c2c-878e-fa1aa15ab765",
        "35a43142-90c2-4a57-8ab4-c3d510ffccd7",
        "63555b49-c22d-4ba9-8a29-4cf04436f1ab",
        "44106ccd-3f9a-40d0-a730-0f30c528c66f",
        "830a4412-eb3b-4b70-b9fb-5355d37d3f02"
      ]
    }
  ],
  "stories": [
    {
      "id": "693d3ccb-2f41-4be6-81d4-5e7a1a67a5fb",
      "feature_id": "63945bb7-424a-4289-86c2-4be15907723f",
      "title": "按既定条件查询资料并呈现结果",
      "acs": [
        {
          "id": "bf4a8c69-a5a4-4047-b88c-1dfefdc1f961",
          "text": "资料查询页提供列表及六个既定筛选/展示条件，其中两个精确匹配筛选、四个展示条件；单数据源、单角色，显示查询结果、无结果或失败反馈。",
          "evidence_refs": [
            "0568d7fc-7a5c-4451-be14-d1a351a05e80"
          ]
        },
        {
          "id": "19f77b89-fc39-425d-b6a2-fbe41a1654ea",
          "text": "资料查询事务仅查询其对应业务对象，按给定条件精确查询并简单分页，返回有结果、空结果或失败；沿用既有入口的单一权限规则。",
          "evidence_refs": [
            "e3d3cc2b-a867-445d-9b6c-958534e10fa0",
            "a1d48717-5a97-43e9-aa2e-da703b0127cb"
          ]
        },
        {
          "id": "f98a346b-7529-43f8-9cb7-43d51b202e35",
          "text": "资料页面接入公共程序库公开接口并验证本页行为；与另一页对同类失败保持错误码含义及提示一致，支持手动重试，切换查询后不展示前一请求的迟到结果。",
          "evidence_refs": [
            "5fb4ca8c-205b-4045-ab44-94b0b76d92e8",
            "d7c2d88e-c320-475c-b47b-4b89f341267e",
            "204788ee-2632-4112-a6c0-8f2bcad11976"
          ]
        }
      ],
      "notes": "页面与对应 API 均新建。页面内含公共接口消费与本页必要验证，不复制公共程序库实现。编辑、导出、权限管理、跨会话分页恢复、排序聚合及额外非功能专项均不在本期范围。",
      "evidence_refs": [
        "0568d7fc-7a5c-4451-be14-d1a351a05e80",
        "e3d3cc2b-a867-445d-9b6c-958534e10fa0",
        "5fb4ca8c-205b-4045-ab44-94b0b76d92e8",
        "a1d48717-5a97-43e9-aa2e-da703b0127cb",
        "204788ee-2632-4112-a6c0-8f2bcad11976",
        "4c290349-a95e-4ce7-a747-35bb7ed425c4"
      ]
    },
    {
      "id": "da8cc102-6213-4c4c-ba1b-9339389d912f",
      "feature_id": "63945bb7-424a-4289-86c2-4be15907723f",
      "title": "按既定条件查询公告并呈现结果",
      "acs": [
        {
          "id": "186fd2ef-e4e9-426f-884f-c7b2ba35d45a",
          "text": "公告查询页提供列表及六个既定筛选/展示条件，其中两个精确匹配筛选、四个展示条件；单数据源、单角色，显示查询结果、无结果或失败反馈。",
          "evidence_refs": [
            "0568d7fc-7a5c-4451-be14-d1a351a05e80"
          ]
        },
        {
          "id": "bcd0bc73-1936-4352-9c70-99b47a548746",
          "text": "公告查询事务仅查询其对应业务对象，按给定条件精确查询并简单分页，返回有结果、空结果或失败；沿用既有入口的单一权限规则。",
          "evidence_refs": [
            "e3d3cc2b-a867-445d-9b6c-958534e10fa0",
            "a1d48717-5a97-43e9-aa2e-da703b0127cb"
          ]
        },
        {
          "id": "eb048bdb-b4a2-410d-815b-17c47b2ad272",
          "text": "公告页面接入公共程序库公开接口并验证本页行为；与另一页对同类失败保持错误码含义及提示一致，支持手动重试，切换查询后不展示前一请求的迟到结果。",
          "evidence_refs": [
            "5fb4ca8c-205b-4045-ab44-94b0b76d92e8",
            "d7c2d88e-c320-475c-b47b-4b89f341267e",
            "204788ee-2632-4112-a6c0-8f2bcad11976"
          ]
        }
      ],
      "notes": "页面与对应 API 均新建。页面内含公共接口消费与本页必要验证，不复制公共程序库实现。编辑、导出、权限管理、跨会话分页恢复、排序聚合及额外非功能专项均不在本期范围。",
      "evidence_refs": [
        "0568d7fc-7a5c-4451-be14-d1a351a05e80",
        "e3d3cc2b-a867-445d-9b6c-958534e10fa0",
        "5fb4ca8c-205b-4045-ab44-94b0b76d92e8",
        "a1d48717-5a97-43e9-aa2e-da703b0127cb",
        "204788ee-2632-4112-a6c0-8f2bcad11976",
        "4c290349-a95e-4ce7-a747-35bb7ed425c4"
      ]
    },
    {
      "id": "9c1ccde7-4b44-4732-9455-ef8684d5e85f",
      "feature_id": "8157478e-cebe-4f4e-b782-21552e2f5d0c",
      "title": "交付独立版本管理的公共查询客户端程序库",
      "acs": [
        {
          "id": "9469bcbb-dd14-45c4-9fb6-8bcd62bdd3f7",
          "text": "交付一份独立版本管理的应用级程序库，提供 query、cancel、normalizeError、bindRequestState 四个公开接口供两页使用，包含示例、基础兼容说明和独立验证。",
          "evidence_refs": [
            "d7c2d88e-c320-475c-b47b-4b89f341267e",
            "204788ee-2632-4112-a6c0-8f2bcad11976"
          ]
        },
        {
          "id": "c8b3ae47-ee50-47e8-b557-19c4ff0f52fd",
          "text": "程序库统一实现错误转换、手动重试调用和迟到响应处理，支撑两页一致失败语义与查询切换行为；公共构建及其独立验证仅交付一份。",
          "evidence_refs": [
            "5fb4ca8c-205b-4045-ab44-94b0b76d92e8",
            "204788ee-2632-4112-a6c0-8f2bcad11976"
          ]
        }
      ],
      "notes": "沿用标准实现；不承担 UI 渲染、历史版本兼容、插件扩展、跨应用治理或额外安全/性能专项。只读查询不意味着新增自动重试要求。",
      "evidence_refs": [
        "5fb4ca8c-205b-4045-ab44-94b0b76d92e8",
        "d7c2d88e-c320-475c-b47b-4b89f341267e",
        "204788ee-2632-4112-a6c0-8f2bcad11976",
        "cfea3961-963a-4b07-b20a-1fb8a12470f6"
      ]
    },
    {
      "id": "6f203267-9aba-4ef2-86fa-f0529de82a56",
      "feature_id": "15d9e368-7bbe-4c4c-9410-9785c6bc0d3c",
      "title": "交付既有资料迁移资产及字段与记录核验结果",
      "acs": [
        {
          "id": "59e86291-3186-4635-9d1d-e12497be4f18",
          "text": "按单一资料源目标组合和一个对象组的14个既定字段一对一映射，形成装载及字段/记录核验资产，支持既有资料进入目标存储后可被查询，资料编号、标题、正文等约定字段保持一致。",
          "evidence_refs": [
            "1d8c0ae0-0d9e-4a3c-832e-07b66f86a2f8",
            "d94cc735-fd04-4c2c-878e-fa1aa15ab765"
          ]
        },
        {
          "id": "19c9a425-c8b2-47f5-ad8f-6d8fb9f6343c",
          "text": "使用客户提供的脱敏样本和非生产目标环境，由本期开发团队完成迁移资产自测及字段/记录核验，并交付供发布与切换方案引用的核验结果。",
          "evidence_refs": [
            "63555b49-c22d-4ba9-8a29-4cf04436f1ab",
            "44106ccd-3f9a-40d0-a730-0f30c528c66f",
            "830a4412-eb3b-4b70-b9fb-5355d37d3f02"
          ]
        }
      ],
      "notes": "按已明确质量基线和允许整体回滚的边界交付；不含清洗、持续同步、双写、零停机或独立停机时长门禁。公告无需迁移。开发方不直接访问生产取数；客户执行独立演练与生产迁移。",
      "evidence_refs": [
        "1d8c0ae0-0d9e-4a3c-832e-07b66f86a2f8",
        "d94cc735-fd04-4c2c-878e-fa1aa15ab765",
        "63555b49-c22d-4ba9-8a29-4cf04436f1ab",
        "44106ccd-3f9a-40d0-a730-0f30c528c66f",
        "830a4412-eb3b-4b70-b9fb-5355d37d3f02",
        "f83f9794-4b83-47b6-830d-2514a14ab722"
      ]
    },
    {
      "id": "b8d01435-d96e-491d-a530-3a5265b2b276",
      "feature_id": "15d9e368-7bbe-4c4c-9410-9785c6bc0d3c",
      "title": "形成对应版本的发布与切换方案",
      "acs": [
        {
          "id": "5f3bf118-0e7f-424f-b3c6-cc624b0fd351",
          "text": "为本期同一部署组件、一个执行团队和已确定窗口形成一份版本发布与切换方案，沿用现有六步规范、标准回滚及 Go/No-Go 判据，不重新设计发布策略。",
          "evidence_refs": [
            "35a43142-90c2-4a57-8ab4-c3d510ffccd7",
            "44106ccd-3f9a-40d0-a730-0f30c528c66f"
          ]
        },
        {
          "id": "3300993a-9011-49ed-84db-3d00792a60c2",
          "text": "方案引用迁移资产验证通过的字段/记录核验结果，并明确客户已有团队承担独立演练、生产迁移、部署和正式验收，本期负责方案与迁移资产及其必要验证。",
          "evidence_refs": [
            "63555b49-c22d-4ba9-8a29-4cf04436f1ab",
            "44106ccd-3f9a-40d0-a730-0f30c528c66f",
            "830a4412-eb3b-4b70-b9fb-5355d37d3f02"
          ]
        }
      ],
      "notes": "客户培训责任沿用 HLD；本期不另建发布执行、迁移演练或正式验收测试 Task。方案编制的必要核对包含在本工作中。",
      "evidence_refs": [
        "35a43142-90c2-4a57-8ab4-c3d510ffccd7",
        "63555b49-c22d-4ba9-8a29-4cf04436f1ab",
        "44106ccd-3f9a-40d0-a730-0f30c528c66f",
        "830a4412-eb3b-4b70-b9fb-5355d37d3f02",
        "bcf8d9fd-12ba-491d-b709-32a330d2b5f8"
      ]
    }
  ],
  "tasks": [
    {
      "id": "1c0183a4-1a77-4859-afb2-2eab47104a50",
      "story_id": "693d3ccb-2f41-4be6-81d4-5e7a1a67a5fb",
      "name": "新建资料查询页并接入公共查询客户端",
      "work_type_name": "信息展示与查询页面",
      "work_mode": "新建",
      "complexity": "M",
      "integration_type": null,
      "notes": "实现本页列表、两个精确筛选与四个展示条件、结果反馈，以及公共接口接入和本页错误提示、手动重试、迟到响应行为验证。公共转换与请求状态机制由程序库交付，不重复建设；本页自身必要验证内含。",
      "not_applicable_fields": [
        "integration_type"
      ],
      "evidence_refs": [
        "0568d7fc-7a5c-4451-be14-d1a351a05e80",
        "5fb4ca8c-205b-4045-ab44-94b0b76d92e8",
        "a1d48717-5a97-43e9-aa2e-da703b0127cb",
        "204788ee-2632-4112-a6c0-8f2bcad11976",
        "4c290349-a95e-4ce7-a747-35bb7ed425c4"
      ],
      "classification_basis": [
        {
          "fields": [
            "work_type_name",
            "work_mode"
          ],
          "evidence_refs": [
            "0568d7fc-7a5c-4451-be14-d1a351a05e80",
            "5fb4ca8c-205b-4045-ab44-94b0b76d92e8",
            "a1d48717-5a97-43e9-aa2e-da703b0127cb",
            "204788ee-2632-4112-a6c0-8f2bcad11976",
            "4c290349-a95e-4ce7-a747-35bb7ed425c4"
          ],
          "standard_id": "FE-VIEW",
          "rationale": "H-B1 明确本页面新增；以每页面为单位匹配 FE-VIEW，公开接口消费及本页验证属于页面交付内部工作。"
        },
        {
          "fields": [
            "complexity"
          ],
          "evidence_refs": [
            "0568d7fc-7a5c-4451-be14-d1a351a05e80",